{"run":34,"commit":"beed459","metric":179291.99,"metrics":{},"status":"keep","description":"Trim GetRequestHeader's common default-User-Agent path a bit further by keeping the existing header.Add-based custom-header construction but, when User-Agent is absent, assigning the canonical User-Agent entry directly instead of routing that final guaranteed-canonical insertion through Header.Set. This preserves the same header contents while cutting a small but broad request/stream-one helper cost, and dockerized splithttp tests stayed green.","timestamp":1773662410517,"segment":0}
{"run":35,"commit":"28c88c1","metric":177904.64,"metrics":{},"status":"keep","description":"Keep the previous narrow GetRequestHeader improvement and follow it with a small allocation-shape cleanup: build the default-header case with make(http.Header, 1) plus direct User-Agent assignment, and pre-size the custom-header map to len(c.Headers)+1 before the existing Header.Add loop. This preserves header contents and the same canonicalization behavior for configured headers while trimming map setup/growth overhead on common no-header and small-header configs. Dockerized splithttp tests stayed green.","timestamp":1773662814458,"segment":0}
{"run":36,"commit":"28c88c1","metric":202700.09,"metrics":{},"status":"discard","description":"Tried a new one-custom-header GetRequestHeader fast path: when the config has exactly one custom header, build the fresh map with capacity 2 and use Header.Set for that single configured header before applying the existing default User-Agent fallback, while leaving the general multi-header path on Header.Add. Although this looked like a plausible broad win for common small-header configs, the widened mixed workload regressed badly, so discard.","timestamp":1773663018216,"segment":0}
{"run":37,"commit":"28c88c1","metric":199764.32,"metrics":{},"status":"discard","description":"Tried a one-custom-header GetRequestHeader specialization that uses a tiny capacity-2 map plus Header.Set for the single configured header before the existing default User-Agent fallback, leaving the multi-header path on Header.Add. This was a plausible follow-on after the recent GetRequestHeader wins, but it regressed the widened mixed workload, so discard.","timestamp":1773663187814,"segment":0}
{"run":38,"commit":"28c88c1","metric":179909.67,"metrics":{},"status":"discard","description":"Tried a tiny XMUX hot-path cleanup in tryGetXmuxClientFast: reuse the already-computed masked start index in the power-of-two + all-closed-flags + concurrency-limited fast branch instead of recomputing int(nextIndex)&mask for the initial scan cursor. The semantics stayed identical, but the widened mixed workload was slightly worse, so discard.","timestamp":1773663364713,"segment":0}
{"run":39,"commit":"28c88c1","metric":187300.39,"metrics":{},"status":"discard","description":"Tried narrowing server-side header canonicalization on the broadened stream-one path by directly assigning the common non-obfs response X-Padding header in ServeHTTP instead of calling writer.Header().Set for that single guaranteed-canonical key. Despite the profiler showing this response-header Set in the hot stream-one slice, the widened mixed workload regressed, so discard.","timestamp":1773663718571,"segment":0}
{"run":40,"commit":"8fe768b","metric":173784.34,"metrics":{},"status":"keep","description":"Trim ApplyMetaToRequest's common path-placement helper a bit further by replacing appendToPath's strings.HasSuffix check with a direct trailing-byte test. This preserves the same path append behavior for empty, slash-terminated, and non-slash paths while shaving broad request/stream-one metadata work, and dockerized splithttp tests stayed green.","timestamp":1773664824818,"segment":0}
{"run":41,"commit":"8fe768b","metric":183858,"metrics":{},"status":"discard","description":"Tried a narrower GetRequestHeader follow-up after the recent request-header wins: replace the trailing header.Get(\"User-Agent\") probe on the freshly built local map with a direct canonical map read that still treats an empty first value as missing before applying the default Chrome UA fallback. This preserved the empty-User-Agent behavior, but the widened mixed workload regressed, so discard.","timestamp":1773664997421,"segment":0}
{"run":42,"commit":"8fe768b","metric":201059,"metrics":{},"status":"discard","description":"Tried a narrower server-side CORS fast path in WriteResponseHeader: cache writer.Header() once, use the raw placement fields to skip the normalized cookie-placement checks on the common non-OPTIONS/no-cookie path, and return early after setting Access-Control-Allow-Origin when no Allow-Credentials or preflight headers are needed. The logic preserved the same defaults because empty placement fields never normalize to cookie, but the widened mixed workload regressed badly, so discard.","timestamp":1773665387472,"segment":0}
{"run":43,"commit":"8fe768b","metric":188309.23,"metrics":{},"status":"discard","description":"Tried a tiny stream-one validation cleanup in ServeHTTP: replace strings.HasPrefix on request.URL.Path with an explicit length-and-slice prefix check against the already-normalized handler path. The semantics stayed identical for valid and invalid paths, but the widened mixed workload regressed, so discard.","timestamp":1773665545820,"segment":0}
