{"run":24,"commit":"be193c6","metric":167634.06,"metrics":{},"status":"discard","description":"Retry a specialized immutable XMUX snapshot pointer for the all-closed-flags case, not just the power-of-two subset, so tryGetXmuxClientFast can skip the general snapshot load and allClosedFlags dispatch on more of the common path. The fresh combined profile justified a revisit, but the broader xhttp_ns_sum still regressed, so discard.","timestamp":1773635906248,"segment":0}
{"run":25,"commit":"be193c6","metric":182287.94,"metrics":{},"status":"discard","description":"Try a server-side compatibility fix for the real intermittent 400 stream-one failures by widening implicit default xpadding validation so legacy-default and balanced-default peers accept each other's default padding ranges, and add focused tests reproducing those cross-profile requests. This likely addresses the user-reported 80-99 / >640 default-range mismatch, but under the current client-heavy xhttp benchmark segment it regressed the primary metric, so discard for now and revisit under a broader end-to-end workload.","timestamp":1773646426680,"segment":0}
{"type":"config","name":"XHTTP broader workload including server-side stream-one handling and compatibility","metricName":"xhttp_ns_sum","metricUnit":"ns","bestDirection":"lower"}
{"run":1,"commit":"50a0571","metric":237485.78,"metrics":{},"status":"keep","description":"Broaden the XHTTP workload again to include server-side stream-one handling and the real balanced-client vs legacy-default-server compatibility case that was producing intermittent 400s in the field: add end-to-end-ish stream-one benchmarks for balanced→balanced and balanced→legacy-default handling, and make implicit default xpadding validation accept the union of legacy/balanced default ranges when xPaddingBytes is left unset so mixed-profile peers stop rejecting each other. Add focused tests for both directions and reset the baseline on this wider workload; splithttp tests stay green.","timestamp":1773646855286,"segment":0}
{"run":2,"commit":"983f352","metric":229502.64,"metrics":{},"status":"keep","description":"Speed up the newly added server-side stream-one / compatibility workload by teaching ExtractXPaddingFromRequest to scan the common safe query-in-header padding URL directly for the x_padding key before falling back to full url.Parse(...).Query().Get(...). Apply the same fast path to both the legacy Referer branch and the general configured header branch, while preserving the parse fallback for encoded or unusual inputs; splithttp tests stay green.","timestamp":1773647275871,"segment":0}
{"run":3,"commit":"983f352","metric":243774.35,"metrics":{},"status":"discard","description":"Tried shaving the broadened stream-one path with smaller helper cleanups: return early from ApplyMetaToRequest when both session and seq are empty, fast-path balanced GetResponseContentType when Accept is missing, and replace ExtractMetaFromRequest's strings.Split-based path parsing with a two-segment scanner plus added coverage for empty-path and mixed placement cases. Despite fewer allocs in the stream-one benches, the primary mixed xhttp workload regressed, so discard.","timestamp":1773648143562,"segment":0}
{"run":4,"commit":"9554b15","metric":216823.52,"metrics":{},"status":"keep","description":"Speed up the broadened server-side stream-one path by trimming common ServeHTTP fallback overhead: add a cheap SplitHostPort+ParseIP fast path for request.RemoteAddr with ResolveTCPAddr fallback for unusual inputs, reuse the normalized xpadding range/method once per request, and bypass the generic response-padding helper stack for the common non-obfs response header case by writing X-Padding directly. Add IPv4/IPv6/hostname parsing coverage; splithttp tests stay green.","timestamp":1773648832278,"segment":0}
{"run":5,"commit":"dda95a0","metric":213806.05,"metrics":{},"status":"keep","description":"Trim more common request/stream-one helper overhead without changing semantics: in GetRequestHeader, fast-path the empty-custom-header case by returning only the default User-Agent directly; in balanced GetResponseContentType, return application/octet-stream immediately when Accept is absent instead of lowercasing/scanning an empty string; and reorder FillPacketRequest's balanced content-type guard so non-balanced body uploads skip an unnecessary header lookup. Add empty-Accept coverage; splithttp tests stay green.","timestamp":1773649206577,"segment":0}
{"run":6,"commit":"b6c59dd","metric":192959.82,"metrics":{},"status":"keep","description":"Speed up query-in-header xpadding again by adding a raw-URL safe-append fast path in ApplyXPaddingToHeader: append x_padding directly onto already-normalized URLs, including fragment-preserving insertion before #..., and only fall back to url.Parse plus setURLQueryParam when the key already exists or the query needs full parsing. Add focused tests covering fragment preservation and duplicate-key replacement; splithttp tests stay green.","timestamp":1773649591589,"segment":0}
{"run":7,"commit":"b6c59dd","metric":218776.35,"metrics":{},"status":"discard","description":"Tried specializing xpadding query writes further by adding a value-known-safe URL query helper for generated padding so ApplyPaddingToQuery and the parsed fallback in ApplyXPaddingToHeader could skip re-validating the generated padding string on every request. Despite being semantics-preserving for repeat-x/tokenish padding, the primary mixed workload regressed, so discard.","timestamp":1773650032425,"segment":0}
{"run":8,"commit":"b6c59dd","metric":238255.55,"metrics":{},"status":"discard","description":"Tried a very small XMUX fast-path cleanup in tryGetXmuxClientFast: cache m.concurrency and snapshot client-count metadata in locals, reuse the first masked index in the dedicated power-of-two snapshot branch, and thread those locals through the hot loops to reduce repeated field loads. This unexpectedly regressed the primary mixed workload, so discard.","timestamp":1773650235347,"segment":0}
{"run":9,"commit":"b6c59dd","metric":208876.82,"metrics":{},"status":"discard","description":"Tried reusing the caller's existing empty request.Header map on the common behavior=nil path instead of always allocating/replacing a fresh header map in FillStreamRequest and FillPacketRequest, plus added focused tests covering that empty-header reuse path. This cut bytes and allocs across the request benchmarks, but the primary mixed xhttp workload regressed versus the current best, so discard.","timestamp":1773650565536,"segment":0}
{"run":10,"commit":"b6c59dd","metric":223471.99,"metrics":{},"status":"discard","description":"Tried replacing request.URL.String() in FillStreamRequest and FillPacketRequest with a common-case simple URL-string builder that fast-paths the normal scheme+host+path(+query/+fragment) XHTTP request form and falls back to url.URL.String() for opaque or unusual URLs. Added coverage for simple and opaque URL equivalence. Despite trimming some request-side allocation metrics, the primary mixed workload regressed, so discard.","timestamp":1773650982854,"segment":0}
{"run":11,"commit":"b6c59dd","metric":210370.18,"metrics":{},"status":"discard","description":"Tried reshaping ServeHTTP control flow around the widened stream-one workload by routing directly on the existing sessionId/method/seq decision and moving scMaxEachPostBytes plus uplinkDataKey computation down into the packet-up-only branch, so stream-one requests skip unused packet-up normalization work. Despite helping the intended stream-one common path structurally, the primary mixed workload regressed versus the current best, so discard.","timestamp":1773651197839,"segment":0}
{"run":12,"commit":"b6c59dd","metric":226423.38,"metrics":{},"status":"discard","description":"Tried a path-placement micro-optimization in ApplyMetaToRequest: when both session and seq use the default path placement, append both segments in one shot and skip the normalized key lookups plus second suffix check. Added focused path-append coverage. It reduced some bytes/allocs on the body request bench, but the primary mixed workload regressed, so discard.","timestamp":1773651697970,"segment":0}
{"run":13,"commit":"b6c59dd","metric":230266.14,"metrics":{},"status":"discard","description":"Tried caching more request-handler normalization on the server side: add a requestHandler constructor that precomputes normalized xpadding range/method/response-padding config, cached uplink-data key plus post-size limit, and cached allow-credentials state so ServeHTTP can avoid repeating config normalization and use a handler-local response-header helper. This looked structurally sound for real traffic too, but it regressed the primary mixed workload, so discard.","timestamp":1773652001199,"segment":0}
{"run":14,"commit":"b6c59dd","metric":233625.98,"metrics":{},"status":"discard","description":"Tried isolating the common no-metadata client path instead of the earlier broader regressing ApplyMeta bundle: skip calling ApplyMetaToRequest from FillStreamRequest when sessionId is empty, and from FillPacketRequest when both session and seq are empty, so stream-one requests avoid a useless metadata helper call. Despite being semantics-preserving and narrower than the prior discarded bundle, the primary mixed workload regressed, so discard.","timestamp":1773652420267,"segment":0}
{"run":15,"commit":"b6c59dd","metric":199642.62,"metrics":{},"status":"discard","description":"Tried narrowing Content-Type work on the common behavior=nil stream request path: in FillStreamRequest, only probe balanced upload content types when a non-nil RequestBehavior is present, while keeping the legacy gRPC default behavior unchanged; in FillPacketRequest, guard the balanced upload-content-type path with behavior != nil as well. This reduced some helper work on stream-one requests but still regressed the primary mixed workload versus the current best, so discard.","timestamp":1773652713481,"segment":0}
{"run":16,"commit":"b6c59dd","metric":205318.92,"metrics":{},"status":"discard","description":"Tried narrowing GetRequestPaddingConfig's obfs-mode work by populating only the placement fields actually used by each xpadding placement: skip normalized header lookup for query/cookie placements, skip key lookup for plain header placement, and set Method once up front. Despite being a small helper-level cleanup on hot request paths, the primary mixed workload regressed, so discard.","timestamp":1773653069566,"segment":0}
{"run":17,"commit":"b6c59dd","metric":204586.48,"metrics":{},"status":"discard","description":"Tried extending the direct cookie payload builder in FillPacketRequest so that, when all extra cookie placements are safely appendable, it also appends xpadding/session/seq cookies directly into the same Cookie builder instead of first building payload cookies and then routing xpadding/meta through repeated appendCookieHeader/AddCookie work. Added coverage that the combined cookie path still leaves payload plus extra cookies visible through request.Cookie. This improved secondary bytes/allocs strongly, but the primary mixed workload still regressed versus the current best, so discard.","timestamp":1773653465063,"segment":0}
{"run":18,"commit":"b6c59dd","metric":224735.76,"metrics":{},"status":"discard","description":"Tried replacing the per-acquisition XMUX closed-flag probes with close-notifier invalidation: connections that can notify on close now nil the fast snapshots and set sweepDue, letting the common all-notifier fast path return directly without atomic closedFlag.Load calls. Added coverage that a notifying off-cursor closed client triggers immediate sweep/refill instead of waiting for the periodic sweep. Despite being a profiler-backed real-path idea aimed squarely at the heavy atomic.Bool.Load cost, the widened mixed workload regressed versus the current best, so discard.","timestamp":1773654421797,"segment":0}
{"run":19,"commit":"b6c59dd","metric":195132.24,"metrics":{},"status":"discard","description":"Tried a tiny helper-level fixed-range fast path in RangeConfig.rand: when From==To, return the single configured value directly instead of routing through crypto.RandBetween and its cross-package call overhead. This is semantics-preserving for all fixed XHTTP ranges (xpadding bytes, chunk sizes, sampled XMUX limits) and came much closer than recent tries, but the widened mixed workload still landed slightly worse than the current best, so discard.","timestamp":1773654842188,"segment":0}
{"run":20,"commit":"b6c59dd","metric":200308.14,"metrics":{},"status":"discard","description":"Tried a narrower server-side meta-extraction fast path: in ExtractMetaFromRequest, skip strings.Split when the validated path suffix is empty, since stream-one requests with default path-based metadata often carry no session/seq segments at all. Added focused tests covering the empty-suffix path plus a mixed path+query case. This clearly improved secondary bytes/allocs in the widened workload, but the primary metric still regressed versus the current best, so discard.","timestamp":1773655253375,"segment":0}
{"run":21,"commit":"b6c59dd","metric":195814.54,"metrics":{},"status":"discard","description":"Tried narrowing the appendCookieHeader hotspot highlighted by the request profile: avoid strings.Join plus Header.Set on the common Cookie-header cases by directly assigning the canonical Cookie slice, with a dedicated fast path for a single existing Cookie value and a fallback join only for multi-value Cookie headers. Added coverage that multi-value existing Cookie headers still keep all cookies visible through request.Cookie after metadata appends. Despite directly targeting a real request-path hotspot, the widened mixed workload still regressed slightly versus the current best, so discard.","timestamp":1773655686971,"segment":0}
{"run":22,"commit":"b6c59dd","metric":226016.42,"metrics":{},"status":"discard","description":"Tried narrowing net/http header canonicalization on the xpadding/meta helper path by directly assigning already-canonical default header names (Referer, X-Padding, X-Session, X-Seq) instead of routing those common cases through Header.Set, while preserving Set for custom or non-canonical keys. This targeted the request profile's MIMEHeader.Set / CanonicalMIMEHeaderKey overhead, but the widened mixed workload regressed badly, so discard.","timestamp":1773655932514,"segment":0}
{"run":23,"commit":"b6c59dd","metric":203411.06,"metrics":{},"status":"discard","description":"Tried a narrower fixed-range xpadding fast path after the earlier generic RangeConfig.rand attempt came close but regressed: add a helper used only by request/response xpadding generation so fixed-length xpadding configs return From directly instead of routing through crypto.RandBetween, without touching XMUX sampling or payload chunk-size selection. Applied it in GetRequestPaddingConfig and the server-side response-padding path. Despite being tightly targeted at real request/stream-one hotspots, the widened mixed workload still regressed, so discard.","timestamp":1773656653521,"segment":0}
{"run":24,"commit":"b6c59dd","metric":223700.33,"metrics":{},"status":"discard","description":"Tried making XMUX health-sweep scheduling more asynchronous: remove the timer callback's manager lock by letting the callback only flip atomic sweepDue/sweepScheduled flags, and let the locked picker consult sweepDueFlag directly before sweeping. Added targeted internal coverage that scheduled sweeps also remove off-cursor request-limit-expired and reusable-deadline-expired clients, not just closed ones. Despite being a profiler-backed XMUX idea aimed at reducing timer-callback lock interference and tightening lazy-sweep coverage, the widened mixed workload regressed substantially, so discard.","timestamp":1773657689969,"segment":0}
{"run":25,"commit":"b6c59dd","metric":198025.96,"metrics":{},"status":"discard","description":"Tried reducing the cookie-payload request-shaping base64 hotspot without changing chunk semantics: on the common valid-cookie-token path in FillPacketRequest, encode into a pre-sized []byte with base64.RawURLEncoding.Encode and stream those bytes directly into the Cookie builder, instead of first allocating a full encoded string and then slicing it back into chunk strings. This cut secondary bytes/allocs strongly on the cookie benchmark, but the widened mixed workload still regressed versus the current best, so discard.","timestamp":1773658152504,"segment":0}
{"run":26,"commit":"ed6c0fe","metric":191503.99,"metrics":{},"status":"keep","description":"Speed up request-shaping base64 hot paths by replacing base64.RawURLEncoding.EncodeToString with a no-extra-copy helper that encodes into a fresh []byte and then exposes it as an immutable string via unsafe for chunk slicing. Apply this in FillPacketRequest's header and cookie payload paths plus the matching GetRequestHeaderWithPayload/GetRequestCookiesWithPayload helpers, so common payload emission keeps the same chunk boundaries and values while avoiding the full encoded-string copy. Validated with dockerized splithttp tests; the widened mixed XHTTP workload improves to 191503.99.","timestamp":1773658457967,"segment":0}
{"run":27,"commit":"ed6c0fe","metric":199952.14,"metrics":{},"status":"discard","description":"Tried replacing XMUX closed-flag storage from atomic.Bool to atomic.Uint32 so the hottest fast-path closed probes use Uint32.Load()!=0 instead of Bool.Load, while preserving the same immutable-snapshot selection logic and connection semantics. Updated DefaultDialerClient plus the XMUX benchmark/internal closed-flag fixtures to expose the new flag type. Despite directly targeting the profiler's dominant sync/atomic.(*Bool).Load cost, the widened mixed workload regressed from the new best, so discard.","timestamp":1773658924437,"segment":0}
{"run":28,"commit":"ed6c0fe","metric":199708.37,"metrics":{},"status":"discard","description":"Tried replacing the branchy per-byte switch in xpadding's isURLQueryComponentSafe with a shared precomputed ASCII lookup table, aiming to speed the still-visible query/header padding helpers (appendQueryParamToRawURL, extractQueryParamFromRawURL, and setURLQueryParam) without changing accepted characters or fallback behavior. The behavior stayed the same, but the widened mixed XHTTP workload regressed, so discard.","timestamp":1773659834050,"segment":0}
{"run":29,"commit":"ed6c0fe","metric":208631.8,"metrics":{},"status":"discard","description":"Tried replacing a handful of hot canonical Header.Get lookups with direct reads from already-canonical http.Header map entries (Origin, Referer, Accept, Content-Type, Cookie, and Access-Control request headers) via a small helper, aiming to cut repeated textproto canonicalization in request shaping and stream-one handling without changing observable lookup semantics. The widened mixed workload regressed substantially, so discard.","timestamp":1773660154789,"segment":0}
{"run":30,"commit":"1fef14f","metric":190404.14,"metrics":{},"status":"keep","description":"Replace splithttp's hot RangeConfig.rand path with a package-local lock-free SplitMix64-style pseudo-random generator seeded once at init, while preserving the same [from,to) range semantics and from==to / swapped-bound handling. This removes repeated crypto/rand.Int + math/big overhead from XMUX manager sampling, uplink chunk sizing, and xpadding length selection without changing protocol shape or benchmark semantics. Dockerized splithttp tests stayed green. ","timestamp":1773660491638,"segment":0}
{"run":31,"commit":"b7fc7da","metric":180958.04,"metrics":{},"status":"keep","description":"Cache int-shaped snapshot metadata on immutable XMUX fast snapshots by adding clientCountInt and indexMaskInt alongside the existing uint32 fields, then use those cached ints in the hottest lock-free picker branches instead of re-converting snapshot.clientCount/indexMask on every acquisition. This keeps the same snapshot publication rules and selection semantics while trimming the still-hot fast-path conversion/setup work highlighted by the latest profile. Dockerized splithttp tests stayed green.","timestamp":1773660954256,"segment":0}
{"run":32,"commit":"b7fc7da","metric":186770.31,"metrics":{},"status":"discard","description":"Tried trimming GetRequestHeader allocation churn by reusing a shared default User-Agent value slice and directly assigning that canonical User-Agent entry when no custom User-Agent is present, instead of allocating a fresh one-element value slice and calling Header.Set each time. This improved secondary bytes/allocs across both request shaping and stream-one benches, but the widened mixed XHTTP primary metric regressed, so discard.","timestamp":1773661749914,"segment":0}
{"run":33,"commit":"b7fc7da","metric":223627.24,"metrics":{},"status":"discard","description":"Tried replacing the remaining non-power-of-two XMUX modulo setup in immutable snapshots with a precomputed reciprocal-based exact fastmod helper, plus added arithmetic coverage to verify the helper matches `%` across representative divisors and edge cursor values. The idea was to cut the still-visible non-power-of-two `nextIndex % clientCount` cost without changing selection semantics, but the widened mixed workload regressed badly, so discard.","timestamp":1773662076061,"segment":0}
