{"type":"config","name":"XHTTP XMUX and request-shaping improvements","metricName":"xmux_ns_sum","metricUnit":"ns","bestDirection":"lower"}
{"run":1,"commit":"d752390","metric":0,"metrics":{},"status":"crash","description":"Baseline harness setup: dockerized XHTTP XMUX benchmark scaffolding failed to execute (exit 127); diagnosing autoresearch script invocation.","timestamp":1773605559025,"segment":0}
{"run":2,"commit":"d752390","metric":0,"metrics":{},"status":"checks_failed","description":"Baseline benchmark ran in docker, but the autoresearch checks integration reported a false non-zero result; removing auto-check wrapper and validating tests manually instead.","timestamp":1773605869874,"segment":0}
{"run":3,"commit":"3108034","metric":25229,"metrics":{},"status":"keep","description":"Baseline XHTTP XMUX benchmark harness: added dockerized splithttp XMUX microbenchmarks and autoresearch docs/scripts.","timestamp":1773606153838,"segment":0}
{"run":4,"commit":"af278f5","metric":4170.2,"metrics":{},"status":"keep","description":"Optimize XHTTP XMUX hot path with per-manager random selection and in-place cleanup; add safer xpadding/uplink defaults, preserve query params in Referer padding, and cover the fixes with new splithttp tests.","timestamp":1773606335981,"segment":0}
{"run":5,"commit":"a89e8c0","metric":2043.8,"metrics":{},"status":"keep","description":"Further optimize XHTTP XMUX by merging unusable-client sweeping, eligible-client selection, and warm-refill accounting into one locked pass; preserve the config-default and xpadding fixes while keeping splithttp tests green.","timestamp":1773606564427,"segment":0}
{"run":6,"commit":"0cc2935","metric":1931.9,"metrics":{},"status":"keep","description":"Trim another XHTTP XMUX hot-path branch by dropping a redundant pre-selection warm-refill scheduling check; benchmark improves again while splithttp tests stay green.","timestamp":1773606710872,"segment":0}
{"run":7,"commit":"e598e81","metric":1632.6,"metrics":{},"status":"keep","description":"Replace XHTTP XMUX reservoir-style selection with a one-pass round-robin cursor over the compacted usable client slice; this removes per-eligible RNG work while keeping splithttp tests green.","timestamp":1773607050196,"segment":0}
{"run":8,"commit":"6403b74","metric":1567.2,"metrics":{},"status":"keep","description":"Trim XHTTP XMUX lock-path overhead by replacing the defer-based unlock in GetXmuxClient with explicit unlocks on each return path; splithttp tests remain green.","timestamp":1773607264819,"segment":0}
{"run":9,"commit":"6403b74","metric":1613.2,"metrics":{},"status":"discard","description":"Tried inlining/reordering XMUX usability checks inside the sweep loop to avoid helper overhead, but the benchmark regressed slightly; reverting this hot-path reshuffle.","timestamp":1773607388133,"segment":0}
{"run":10,"commit":"3888446","metric":751.47,"metrics":{},"status":"keep","description":"Add a lazy XHTTP XMUX fast path: perform full pool sweeps on a bounded interval, use cursor-based selection for normal acquisitions, and lazily remove bad entries encountered on the hot path; splithttp tests stay green.","timestamp":1773607744449,"segment":0}
{"run":11,"commit":"3888446","metric":779.18,"metrics":{},"status":"discard","description":"Tried precomputing the XMUX warm target to shave scheduleWarmRefill overhead, but the benchmark regressed slightly; reverting this micro-optimization.","timestamp":1773607871722,"segment":0}
{"run":12,"commit":"3888446","metric":784.38,"metrics":{},"status":"discard","description":"Tried splitting the lazy XMUX picker into separate concurrency/no-concurrency paths to remove a branch from the hot path, but it regressed slightly; reverting.","timestamp":1773608024525,"segment":0}
{"run":13,"commit":"3888446","metric":767,"metrics":{},"status":"discard","description":"Tried relaxing the lazy XMUX health-sweep interval from 250ms to 500ms, but the benchmark regressed slightly; keeping the more conservative interval.","timestamp":1773608137068,"segment":0}
{"run":14,"commit":"3888446","metric":767.6,"metrics":{},"status":"discard","description":"Tried reordering XMUX usability checks to avoid IsClosed on obviously spent clients, but the benchmark regressed slightly; reverting.","timestamp":1773608345139,"segment":0}
{"run":15,"commit":"3888446","metric":778.09,"metrics":{},"status":"discard","description":"Tried initializing XMUX nextSweepAt during manager construction to skip the first sweep-zero check, but it regressed slightly; reverting.","timestamp":1773608497511,"segment":0}
{"run":16,"commit":"3888446","metric":755.01,"metrics":{},"status":"discard","description":"Tried caching clientCount/connectionLimit locals in GetXmuxClient to trim repeated len/field reads, but the benchmark was slightly worse; reverting.","timestamp":1773608626095,"segment":0}
{"run":17,"commit":"fde2e8c","metric":727.5,"metrics":{},"status":"keep","description":"Improve lazy XHTTP XMUX selection by checking OpenUsage before the heavier usability probe on the fast path; saturated clients are skipped immediately while bounded sweeps still clean stale entries, and splithttp tests stay green.","timestamp":1773608808001,"segment":0}
{"run":18,"commit":"fde2e8c","metric":763.26,"metrics":{},"status":"discard","description":"Tried simplifying the lazy XMUX sweep-deadline branch by relying on `now.Before(nextSweepAt)` alone, but the benchmark regressed slightly; reverting.","timestamp":1773608962315,"segment":0}
{"run":19,"commit":"fde2e8c","metric":764.99,"metrics":{},"status":"discard","description":"Tried removing the redundant non-empty slice check from the lazy XMUX fast-path loop condition, but the benchmark regressed slightly; reverting.","timestamp":1773609048096,"segment":0}
{"run":20,"commit":"fde2e8c","metric":772.28,"metrics":{},"status":"discard","description":"Tried caching the lazy fast-path client count locally inside pickAvailableClientLocked to avoid repeated len() calls, but the benchmark regressed slightly; reverting.","timestamp":1773609272815,"segment":0}
{"run":21,"commit":"fc1c6b4","metric":707.67,"metrics":{},"status":"keep","description":"Track approximate XHTTP XMUX usable-count state incrementally on client creation/removal/exhaustion and reconcile it on sweeps, so the hot path avoids threading usableCount through picker returns and warm-refill checks; splithttp tests stay green.","timestamp":1773609782943,"segment":0}
{"run":22,"commit":"fc1c6b4","metric":767.33,"metrics":{},"status":"discard","description":"Only call XHTTP XMUX warm-refill scheduling after tracked client-count changes instead of every GetXmuxClient call; this slightly regressed the Dockerized xmux benchmark, so discard.","timestamp":1773610147885,"segment":0}
{"run":23,"commit":"fc1c6b4","metric":788.84,"metrics":{},"status":"discard","description":"Reorder XHTTP XMUX GetXmuxClient around an early hot-path return when a selected client exists and the pool is already at its connection target; this regressed the Dockerized xmux benchmark, so discard.","timestamp":1773610312765,"segment":0}
{"run":24,"commit":"fc1c6b4","metric":767.47,"metrics":{},"status":"discard","description":"Add a direct first-candidate fast path in the lazy XHTTP XMUX picker before falling back to the full scan; the extra miss-path duplication slightly regressed the Dockerized xmux benchmark, so discard.","timestamp":1773610480494,"segment":0}
{"run":25,"commit":"fc1c6b4","metric":791.45,"metrics":{},"status":"discard","description":"Specialize XHTTP XMUX around config-level reuse/request/deadline flags and cached normalized ranges so the usability probe can skip disabled limits; this regressed the Dockerized xmux benchmark, so discard.","timestamp":1773610750003,"segment":0}
{"run":26,"commit":"c32cc90","metric":150.68,"metrics":{},"status":"keep","description":"Replace per-call XHTTP XMUX sweep deadline polling with a timer-armed sweepDue flag, so the hot path only touches time.Now when a sweep is actually due or reusable-deadline configs need it; add coverage for off-cursor closed-client cleanup across the scheduled sweep boundary.","timestamp":1773611612773,"segment":0}
{"run":27,"commit":"0ade547","metric":143.69,"metrics":{},"status":"keep","description":"Cap XHTTP XMUX warmConnections against the sampled max-connections limit once in the manager constructor and reuse that stored target directly in warm fill/refill checks, trimming more hot-path bookkeeping after the timer-armed sweep change.","timestamp":1773611890577,"segment":0}
{"run":28,"commit":"0ade547","metric":143.93,"metrics":{},"status":"discard","description":"Split XHTTP XMUX warm-refill into an inlineable needsWarmRefillLocked check plus a separate scheduler to avoid entering the goroutine-launch helper on the common no-refill path; this was slightly worse than the new baseline, so discard.","timestamp":1773612031571,"segment":0}
{"run":29,"commit":"6ae7a2e","metric":141.6,"metrics":{},"status":"keep","description":"Specialize the XHTTP XMUX usability probe to skip LeftRequests and reusable-deadline checks unless those limits are actually configured, using the existing config pointers instead of broader cached flag plumbing; splithttp tests stay green.","timestamp":1773612235214,"segment":0}
{"run":30,"commit":"6ae7a2e","metric":149.62,"metrics":{},"status":"discard","description":"Inline and specialize the lazy XHTTP XMUX hot-loop usability checks directly inside pickAvailableClientLocked to avoid the helper call and repeated config probes; this regressed the Dockerized xmux benchmark, so discard.","timestamp":1773612452608,"segment":0}
{"run":31,"commit":"6ae7a2e","metric":155.31,"metrics":{},"status":"discard","description":"Cache only the configured XHTTP XMUX request-limit and reusable-deadline booleans on the manager so pickXmuxClientLocked and isUsableClientLocked can avoid repeated config-pointer checks; this regressed the Dockerized xmux benchmark, so discard.","timestamp":1773612589932,"segment":0}
{"run":32,"commit":"6ae7a2e","metric":141.98,"metrics":{},"status":"discard","description":"Add a no-cleanup fast path to lazy XHTTP XMUX cursor scanning that uses simple linear loops and only falls back to the mutating cleanup loop when a stale client is encountered; this was slightly worse than the current best, so discard.","timestamp":1773612720850,"segment":0}
{"run":33,"commit":"6ae7a2e","metric":144.54,"metrics":{},"status":"discard","description":"Inline the lazy XHTTP XMUX pickXmuxClientLocked logic directly into GetXmuxClient to remove that helper call and keep sweep/time handling in one place; this regressed the Dockerized xmux benchmark, so discard.","timestamp":1773612893862,"segment":0}
{"run":34,"commit":"6ae7a2e","metric":142.7,"metrics":{},"status":"discard","description":"Track whether the XHTTP XMUX warm target is already full and only enter warm-refill scheduling when the pool is below target or no refill is in flight; this slightly regressed the Dockerized xmux benchmark, so discard.","timestamp":1773613198729,"segment":0}
{"run":35,"commit":"d1d37fa","metric":132.98,"metrics":{},"status":"keep","description":"Split the lazy XHTTP XMUX picker into a simple no-deadline/no-request-limit fast path and a full path, so the common per-client scan avoids extra request/deadline checks while configured limits still use the stricter path; splithttp tests stay green.","timestamp":1773613492718,"segment":0}
{"run":36,"commit":"d8ec80d","metric":129.94,"metrics":{},"status":"keep","description":"Further specialize the lazy XHTTP XMUX fast path for managers without a concurrency cap, so the common warm-pool selection loop skips the OpenUsage atomic entirely while concurrency-limited or request/deadline-limited cases still use the stricter picker variants; splithttp tests stay green.","timestamp":1773613714710,"segment":0}
{"run":37,"commit":"f1e3448","metric":117.85,"metrics":{},"status":"keep","description":"Move XHTTP XMUX lazy fast-path dispatch into pickXmuxClientLocked so it picks the specialized picker variant up front and avoids an extra wrapper call plus redundant now.IsZero/request-limit branching on every acquisition; splithttp tests stay green.","timestamp":1773613998853,"segment":0}
{"run":38,"commit":"f1e3448","metric":119.15,"metrics":{},"status":"discard","description":"Add an even narrower XHTTP XMUX no-concurrency fast path that directly returns the cursor client when it is usable and only falls back to the cleanup loop when that cursor entry is stale; this slightly regressed the Dockerized xmux benchmark, so discard.","timestamp":1773614211880,"segment":0}
{"run":39,"commit":"f1e3448","metric":118.22,"metrics":{},"status":"discard","description":"Inline the XHTTP XMUX warm-refill guard directly at GetXmuxClient call sites so the common full-pool path avoids calling scheduleWarmRefillLocked at all; this slightly regressed the Dockerized xmux benchmark, so discard.","timestamp":1773614427411,"segment":0}
{"run":40,"commit":"f92f332","metric":116.6,"metrics":{},"status":"keep","description":"Further specialize the XHTTP XMUX lazy picker for managers without CMaxReuseTimes by adding closed-only variants for the no-concurrency and no-deadline/no-request-limit paths, so common default pools skip leftUsage checks while stricter variants still handle configured reuse/request/deadline limits; splithttp tests stay green.","timestamp":1773614643290,"segment":0}
{"run":41,"commit":"f1e3448","metric":120.32,"metrics":{},"status":"discard","description":"Precompute a compact XHTTP XMUX picker mode in the manager constructor and switch on that mode in pickXmuxClientLocked instead of rechecking config pointers each call; this regressed the Dockerized xmux benchmark, so discard.","timestamp":1773614805050,"segment":0}
{"run":42,"commit":"f92f332","metric":120.97,"metrics":{},"status":"discard","description":"In the XHTTP XMUX concurrency-specialized picker variants, cache the positive concurrency limit locally and remove the redundant per-iteration `m.concurrency > 0` guard inside loops that only run when a concurrency cap is already known to exist; this regressed the Dockerized xmux benchmark, so discard.","timestamp":1773615036884,"segment":0}
{"run":43,"commit":"9f56a59","metric":109.58,"metrics":{},"status":"keep","description":"Only schedule XHTTP XMUX warm refills when usable-count state actually changes (lazy removals, sweep removals, or reuse exhaustion) instead of calling scheduleWarmRefillLocked on every successful selection; splithttp tests stay green.","timestamp":1773615476534,"segment":0}
{"run":44,"commit":"9f56a59","metric":116.93,"metrics":{},"status":"discard","description":"Normalize zero/disabled XHTTP XMUX reuse/request/deadline ranges to nil once in the manager config copy so pickXmuxClientLocked and isUsableClientLocked can use simpler nil-only dispatch checks; this regressed the Dockerized xmux benchmark, so discard.","timestamp":1773615734193,"segment":0}
{"run":45,"commit":"9f56a59","metric":116.45,"metrics":{},"status":"discard","description":"Refactor lazy closed-client removal logging and slice cleanup into a shared slow-path helper to shrink the hottest specialized XHTTP XMUX picker bodies; this was slightly worse than the current best Dockerized xmux benchmark, so discard.","timestamp":1773615968957,"segment":0}
{"run":46,"commit":"9f56a59","metric":129.28,"metrics":{},"status":"discard","description":"Replace the specialized XHTTP XMUX picker loops’ scanned-vs-clientCount bookkeeping with a remaining-counter form in the hot no-reuse and closed-only paths; this substantially regressed the Dockerized xmux benchmark, so discard.","timestamp":1773616201261,"segment":0}
{"run":47,"commit":"9f56a59","metric":0,"metrics":{},"status":"crash","description":"Attempted to add a fast XMUX closed-state path by caching per-client atomic closed flags, but the first pass left mux.go and benchmark plumbing in an inconsistent build state; fixing the refactor and retrying.","timestamp":1773617050111,"segment":0}
{"run":48,"commit":"9f56a59","metric":110.76,"metrics":{},"status":"discard","description":"Cache an optional per-client atomic closed-state pointer in XmuxClient so the hot picker paths can call a tiny isClosed helper instead of repeatedly dispatching through XmuxConn.IsClosed; benchmark mocks and internal closable conns were updated to exercise the same path, but the full Dockerized xmux benchmark was still slightly worse than the current best, so discard.","timestamp":1773617142035,"segment":0}
{"run":49,"commit":"caa2ad1","metric":106.62,"metrics":{},"status":"keep","description":"Cache the xmuxClients slice header locally inside the two hottest specialized XHTTP XMUX lazy pickers and refresh it only after lazy removals, so the common no-removal path avoids repeated manager field reads/indexing while preserving cleanup behavior; splithttp tests stay green.","timestamp":1773617350657,"segment":0}
{"run":50,"commit":"caa2ad1","metric":107.7,"metrics":{},"status":"discard","description":"Tighten the two hottest specialized XHTTP XMUX picker loops a bit further by using equality-only wrap checks and a local nextClientIndex assignment when advancing the round-robin cursor; this was slightly worse than the new best Dockerized xmux benchmark, so discard.","timestamp":1773617686454,"segment":0}
{"run":51,"commit":"9fb2963","metric":88.95,"metrics":{},"status":"keep","description":"Add an immutable XHTTP XMUX client-snapshot fast path for the common no-request-limit/no-deadline/no-reuse cases, using an atomic round-robin cursor plus an atomic sweepDue flag so GetXmuxClient can often return without taking the manager mutex; preserve existing lazy cleanup and warm-refill behavior by falling back to the locked picker as soon as a scanned candidate is closed or the pool still needs growth. splithttp tests stay green.","timestamp":1773618613663,"segment":0}
{"run":52,"commit":"d3ddd06","metric":73.19,"metrics":{},"status":"keep","description":"Replace the immutable XHTTP XMUX fast-path snapshot transport from atomic.Value to a typed atomic pointer holding an immutable snapshot struct, so GetXmuxClient keeps the same lock-free snapshot behavior and fallback-on-closed semantics while avoiding interface load/type-assert overhead on every hot-path acquisition; splithttp tests stay green.","timestamp":1773619006180,"segment":0}
{"run":53,"commit":"d3ddd06","metric":75.92,"metrics":{},"status":"discard","description":"Tried folding the atomic sweepDue gate into the immutable XMUX snapshot itself by niling the fast snapshot while a sweep is pending, so tryGetXmuxClientFast could skip a separate atomic Bool load; this preserved correctness but slightly regressed the Dockerized xmux benchmark, so discard.","timestamp":1773619436335,"segment":0}
{"run":54,"commit":"d3ddd06","metric":86.92,"metrics":{},"status":"discard","description":"Split the immutable XMUX fast path into separate no-concurrency and concurrency helpers so the dispatcher can skip one hot branch and pass a cached concurrency local into the stricter scan; this substantially regressed the Dockerized xmux benchmark, so discard.","timestamp":1773619778076,"segment":0}
{"run":55,"commit":"28e81d8","metric":71.28,"metrics":{},"status":"keep","description":"Shrink the immutable XHTTP XMUX fast-path round-robin cursor from atomic.Uint64 to atomic.Uint32; the cursor only needs wraparound semantics for pool selection, so this trims the hot Add/modulo path without changing snapshot selection behavior or the locked fallback logic. splithttp tests stay green.","timestamp":1773620019738,"segment":0}
{"run":56,"commit":"28e81d8","metric":73.73,"metrics":{},"status":"discard","description":"Cache the fast-path connections and concurrency fields in locals inside tryGetXmuxClientFast so the lock-free XMUX snapshot scan avoids a few repeated manager field reads; this slightly regressed the Dockerized xmux benchmark, so discard.","timestamp":1773620233807,"segment":0}
{"run":57,"commit":"28e81d8","metric":71.63,"metrics":{},"status":"discard","description":"Specialize the no-concurrency branch of the immutable XMUX fast path down to a direct cursor lookup plus closed check, removing its now-redundant one-iteration scan loop; this was slightly worse than the current best Dockerized xmux benchmark, so discard.","timestamp":1773620340064,"segment":0}
{"run":58,"commit":"2c42229","metric":66.39,"metrics":{},"status":"keep","description":"Extend the immutable XHTTP XMUX fast snapshot with cached power-of-two metadata (clientCount, indexMask, powerOfTwo) and use a mask-based index path when the current snapshot size is a power of two, while preserving the existing modulo fallback for other pool sizes; splithttp tests stay green.","timestamp":1773620845513,"segment":0}
{"run":59,"commit":"f1252dc","metric":66.24,"metrics":{},"status":"keep","description":"Publish a nil immutable XMUX fast snapshot when the pool is actually empty, so the hot path can use the atomic pointer nil check as the empty-pool gate and avoid carrying a redundant zero-client snapshot case; preserve the existing power-of-two and fallback selection behavior, with splithttp tests still green.","timestamp":1773621148708,"segment":0}
{"run":60,"commit":"c559187","metric":60.75,"metrics":{},"status":"keep","description":"Only publish the immutable XMUX fast snapshot when the fast path is actually eligible: the pool is non-empty, already at its sampled connection target when bounded, and no request-limit / reusable-deadline / reuse-count configs force the slow path. This moves those gates out of tryGetXmuxClientFast and trims the hot path to the sweep flag plus snapshot load before selection; splithttp tests stay green.","timestamp":1773621556065,"segment":0}
