{"run":61,"commit":"c559187","metric":60.84,"metrics":{},"status":"discard","description":"Tried pre-seeding the immutable XMUX fast-path round-robin cursor to MaxUint32 so tryGetXmuxClientFast could use atomic.Add(1) directly without the current subtract-one adjustment, but the Dockerized xmux benchmark was a touch worse than the new best, so discard.","timestamp":1773621751375,"segment":0}
{"run":62,"commit":"4fc90a6","metric":53.15,"metrics":{},"status":"keep","description":"Cache an optional directly-readable closed flag on each XMUX client when the underlying connection exposes one, and use that in the immutable fast path before falling back to XmuxConn.IsClosed. Real DefaultDialerClient now exposes its existing atomic closed flag, internal closable XMUX test conns use the same path, and the benchmark fake keeps the same always-open behavior while exposing the common production fast path; splithttp tests stay green.","timestamp":1773622134700,"segment":0}
{"run":63,"commit":"f6d8221","metric":49.67,"metrics":{},"status":"keep","description":"Track on each immutable XMUX fast snapshot whether every published client has a direct closed flag, and use dedicated fast branches that call closedFlag.Load() directly without a per-client nil/fallback check when that common case holds; keep the interface fallback for mixed snapshots, with splithttp tests still green.","timestamp":1773622442081,"segment":0}
{"run":64,"commit":"f6d8221","metric":50.67,"metrics":{},"status":"discard","description":"Tried flattening tryGetXmuxClientFast so the power-of-two + all-closed-flags snapshot case becomes a single top-level hot branch before the more general paths, but the reshaped control flow was slightly worse than the current best Dockerized xmux benchmark, so discard.","timestamp":1773622654087,"segment":0}
{"run":65,"commit":"f6d8221","metric":51.5,"metrics":{},"status":"discard","description":"Tried replacing the snapshot powerOfTwo/allClosedFlags bool metadata with a compact bitfield and hot-case flag comparisons in tryGetXmuxClientFast, but that extra snapshot-flags plumbing regressed the Dockerized xmux benchmark, so discard.","timestamp":1773622874190,"segment":0}
{"run":66,"commit":"f6d8221","metric":50.18,"metrics":{},"status":"discard","description":"Tried loading the immutable XMUX fast snapshot before checking sweepDueFlag and combining the nil/sweep gate into one early return branch, but that reshaped entry path was slightly worse than the current best Dockerized xmux benchmark, so discard.","timestamp":1773622987231,"segment":0}
{"run":67,"commit":"f6d8221","metric":53.37,"metrics":{},"status":"discard","description":"Tried flipping the fast-path concurrency scans from `>= continue` to a `< return` shape so the successful path falls directly into the closed check and return, but that branch reshuffle regressed the Dockerized xmux benchmark, so discard.","timestamp":1773623117198,"segment":0}
{"run":68,"commit":"5ab0541","metric":49.37,"metrics":{},"status":"keep","description":"In the immutable XMUX fast path’s power-of-two + all-closed-flags + concurrency-limited branch, replace the per-iteration (nextIndex+scanned)&mask recomputation with an incrementing masked index cursor; preserve selection order and fallback-on-closed semantics, with splithttp tests still green.","timestamp":1773623465889,"segment":0}
{"run":69,"commit":"5ab0541","metric":51.79,"metrics":{},"status":"discard","description":"Revisited fast-path local concurrency caching in the new snapshot context by caching m.concurrency only inside the hottest power-of-two + all-closed-flags branch, but that narrower variant still regressed the Dockerized xmux benchmark, so discard.","timestamp":1773623627785,"segment":0}
{"run":70,"commit":"5ab0541","metric":52.55,"metrics":{},"status":"discard","description":"Tried inverting the all-closed-flags fast-path closed check to return on `!closedFlag.Load()` instead of branching on the rare closed case first, but that reshaped branch direction regressed the Dockerized xmux benchmark, so discard.","timestamp":1773624058673,"segment":0}
{"run":71,"commit":"02615dc","metric":48.86,"metrics":{},"status":"keep","description":"Publish and consult a second immutable XMUX fast-snapshot pointer dedicated to the common power-of-two + all-closed-flags case, so tryGetXmuxClientFast can skip loading the general snapshot and skip the allClosedFlags/powerOfTwo dispatch checks on that hottest path while preserving the existing general immutable snapshot fallback for other eligible cases; splithttp tests stay green.","timestamp":1773624546007,"segment":0}
{"run":72,"commit":"7517ec4","metric":46.35,"metrics":{},"status":"keep","description":"On the specialized immutable XMUX fast path for the common power-of-two + all-closed-flags case, cache the mask as an int local once per acquisition and use int(nextIndex)&mask for both the direct no-concurrency start index and the concurrency-limited masked cursor setup; preserve the specialized snapshot-pointer dispatch and splithttp tests stay green.","timestamp":1773624781031,"segment":0}
{"run":73,"commit":"7517ec4","metric":48.96,"metrics":{},"status":"discard","description":"Tried splitting the specialized power-of-two + all-closed immutable XMUX fast snapshot into its own smaller typed snapshot struct with an int mask precomputed at publish time, but the extra specialized snapshot allocation/plumbing still regressed the Dockerized xmux benchmark, so discard.","timestamp":1773624909625,"segment":0}
{"run":74,"commit":"7517ec4","metric":47.45,"metrics":{},"status":"discard","description":"Tried converting the specialized power-of-two + all-closed snapshot path’s fastNextClientIndex result to int immediately and reusing that int for both start/index masking, but that int-early conversion regressed the Dockerized xmux benchmark versus the current best, so discard.","timestamp":1773625061704,"segment":0}
{"run":75,"commit":"7517ec4","metric":48.83,"metrics":{},"status":"discard","description":"Tried reusing the already-computed specialized power-of-two start index as the concurrency-branch masked cursor seed instead of recomputing `int(nextIndex)&mask`, but that tiny reshuffle regressed the Dockerized xmux benchmark, so discard.","timestamp":1773625201175,"segment":0}
{"run":76,"commit":"7517ec4","metric":48.36,"metrics":{},"status":"discard","description":"Tried caching the specialized immutable power-of-two snapshot mask as an int field on the general XMUX snapshot struct so the hottest path could skip the uint32-to-int conversion at acquisition time, but the larger snapshot metadata regressed the Dockerized xmux benchmark, so discard.","timestamp":1773625553189,"segment":0}
{"run":77,"commit":"7517ec4","metric":47.85,"metrics":{},"status":"discard","description":"Tried moving the specialized power-of-two + all-closed snapshot path’s start-index computation inside the no-concurrency branch so the concurrency branch only computes its masked cursor when needed, but that branch reshuffle regressed the Dockerized xmux benchmark, so discard.","timestamp":1773625667792,"segment":0}
{"type":"config","name":"XHTTP XMUX broader workload including non-power-of-two pools","metricName":"xmux_ns_sum","metricUnit":"ns","bestDirection":"lower"}
{"run":1,"commit":"916a089","metric":100.72,"metrics":{},"status":"keep","description":"Broaden the XHTTP XMUX benchmark workload to reduce power-of-two overfitting by adding non-power-of-two warm-pool and concurrency-filter microbenchmarks (12-connection pools) alongside the existing 8/16-connection cases, then reset the autoresearch baseline on this wider harness; splithttp tests stay green.","timestamp":1773625929183,"segment":0}
{"run":2,"commit":"916a089","metric":106.86,"metrics":{},"status":"discard","description":"On the broadened XMUX workload, tried collapsing the non-power-of-two + all-closed-flags + no-concurrency immutable fast path down to a direct cursor lookup instead of the existing single-iteration loop form, but that reshaped non-power-of-two branch regressed the Dockerized benchmark sum, so discard.","timestamp":1773626140724,"segment":0}
{"run":3,"commit":"d8759fc","metric":97.95,"metrics":{},"status":"keep","description":"On the broadened XMUX workload, replace the immutable fast path’s non-power-of-two + all-closed-flags + concurrency-limited `start+scanned` wrap-adjust loop with an incrementing index cursor that only advances and wraps on saturated candidates; preserve fallback-on-closed behavior, and splithttp tests stay green.","timestamp":1773626369859,"segment":0}
{"run":4,"commit":"d8759fc","metric":112.83,"metrics":{},"status":"discard","description":"Tried extending the broadened-workload specialization by publishing and consulting a second immutable snapshot pointer for the non-power-of-two + all-closed-flags case, but the extra pointer load/plumbing substantially regressed the Dockerized XMUX benchmark sum, so discard.","timestamp":1773626605870,"segment":0}
{"run":5,"commit":"d8759fc","metric":106.68,"metrics":{},"status":"discard","description":"On the broadened workload, tried specializing the all-closed non-power-of-two case further by publishing and consulting a dedicated snapshot pointer for that branch, but the extra atomic pointer load/plumbing regressed the Dockerized xmux benchmark sum, so discard.","timestamp":1773627059563,"segment":0}
{"run":6,"commit":"d8759fc","metric":113.47,"metrics":{},"status":"discard","description":"On the broadened workload, tried replacing the non-power-of-two snapshot start-index modulo with a precomputed reciprocal fast-mod reduction using math/bits.Mul64, but that extra multiplier state and two-multiply reduction regressed the Dockerized xmux benchmark sum, so discard.","timestamp":1773627289874,"segment":0}
{"run":7,"commit":"d8759fc","metric":104.47,"metrics":{},"status":"discard","description":"Revisited the specialized power-of-two + all-closed immutable XMUX snapshot with a smaller dedicated snapshot struct carrying an int mask, but on the broadened workload that extra specialized snapshot allocation/plumbing still regressed the Dockerized xmux benchmark sum, so discard.","timestamp":1773627478702,"segment":0}
{"type":"config","name":"XHTTP transport broader workload including XMUX and request shaping","metricName":"xhttp_ns_sum","metricUnit":"ns","bestDirection":"lower"}
{"run":1,"commit":"f48f410","metric":371767.79,"metrics":{},"status":"keep","description":"Broaden the XHTTP transport workload again to reduce XMUX-only overfitting by adding deterministic packet-up request-shaping benchmarks for FillPacketRequest across header, cookie, and body payload placement variants, update autoresearch.sh to include both XMUX and request-shaping benches, and reset the baseline on the wider xhttp_ns_sum workload; splithttp tests stay green.","timestamp":1773627862485,"segment":0}
{"run":2,"commit":"30f1241","metric":352079.64,"metrics":{},"status":"keep","description":"Optimize the new request-shaping workload in FillPacketRequest by writing encoded payload chunks directly into request.Header for header placement and directly into request cookies for cookie placement, instead of first rebuilding an intermediate payload header/cookie collection and then merging it back into the request. This preserves chunking plus later metadata/xpadding behavior while lowering the broader xhttp_ns_sum workload; splithttp tests stay green.","timestamp":1773628252833,"segment":0}
{"run":3,"commit":"1415b7e","metric":266734.28,"metrics":{},"status":"keep","description":"Optimize the cookie-heavy FillPacketRequest path by writing the generated payload cookies directly into the request Cookie header when the normalized uplink-data key is already a valid cookie token, instead of calling request.AddCookie for every payload chunk. Session/seq/xpadding cookies still use the existing metadata path, preserving observable behavior while removing repeated payload-cookie sanitization/merge overhead; splithttp tests stay green.","timestamp":1773628547614,"segment":0}
{"run":4,"commit":"3a70630","metric":242896.91,"metrics":{},"status":"keep","description":"Reduce packet-up request-shaping formatting overhead by replacing fmt.Sprintf-based payload chunk key generation with direct string concatenation plus strconv.Itoa in both the direct FillPacketRequest paths and the reusable payload header/cookie builders. This preserves the same header/cookie names while lowering the broader xhttp_ns_sum workload; splithttp tests stay green.","timestamp":1773628798029,"segment":0}
{"run":5,"commit":"32986c0","metric":199003.11,"metrics":{},"status":"keep","description":"Speed up packet-up request shaping by reading request bodies with an exact-size fast path when ContentLength is already known, falling back safely for short or overlong bodies, and by caching the normalized uplink chunk-size range once per payload emission loop instead of recomputing it for every chunk. Apply the body-read fast path in both FillPacketRequest and the browser dialer packet sender; splithttp tests stay green.","timestamp":1773629435526,"segment":0}
{"run":6,"commit":"0717737","metric":176362.08,"metrics":{},"status":"keep","description":"Add safe direct-append fast paths for metadata/xpadding cookies and query params: append RFC-safe cookie pairs straight onto the request Cookie header instead of routing through repeated AddCookie sanitization/merge work, and append safe non-duplicate query params straight onto RawQuery instead of reparsing/re-encoding the full URL. Keep fallbacks for duplicate keys and unusual cookie values, and add tests covering duplicate-query replacement plus cookie visibility through request.Cookie; splithttp tests stay green.","timestamp":1773629793652,"segment":0}
{"run":7,"commit":"0717737","metric":177657.05,"metrics":{},"status":"discard","description":"Try avoiding request.URL.String plus raw URL reparsing on the request-side query-in-header xpadding path by building the Referer header from req.URL directly and passing an empty RawURL through FillStreamRequest/FillPacketRequest. This cut bytes/allocs on the body-placement benchmark, but the broader xhttp_ns_sum regressed slightly, so discard.","timestamp":1773630049635,"segment":0}
{"run":8,"commit":"0717737","metric":191668.92,"metrics":{},"status":"discard","description":"Try streamlining GetRequestHeader by preallocating the header map, canonicalizing configured keys directly with textproto.CanonicalMIMEHeaderKey, and assigning single-value slices without going through Header.Add/Get. This kept semantics and secondary metrics flat, but the broader xhttp_ns_sum regressed, so discard.","timestamp":1773630207755,"segment":0}
{"run":9,"commit":"0717737","metric":181214.85,"metrics":{},"status":"discard","description":"Try shaving the exact-size request-body fast path further by checking for one extra byte before falling back to io.ReadAll on the overlong case, and add coverage for short/long content-length mismatches. Secondary bytes improved a bit, but the broader xhttp_ns_sum regressed, so discard.","timestamp":1773630385082,"segment":0}
{"run":10,"commit":"0717737","metric":219250.56,"metrics":{},"status":"discard","description":"Try moving fixed-range specialization out of hot request-shaping loops: when UplinkChunkSize or XPaddingBytes are configured with From==To, use the fixed value directly instead of re-entering the generic random-range path on every chunk/request. The extra branchy duplication regressed the broader xhttp_ns_sum workload badly, so discard.","timestamp":1773630656596,"segment":0}
{"run":11,"commit":"5e9ffe7","metric":163493.07,"metrics":{},"status":"keep","description":"Reduce cookie-heavy FillPacketRequest allocation churn by estimating the final payload Cookie header length from the encoded payload size, normalized chunk range, key, and any existing cookie prefix, then pre-growing the strings.Builder once before streaming payload chunks into it. This preserves the same chunk names/order and existing-cookie behavior while cutting cookie-path allocations; splithttp tests stay green.","timestamp":1773630981020,"segment":0}
{"run":12,"commit":"5e9ffe7","metric":163929.32,"metrics":{},"status":"discard","description":"Try trimming per-chunk cookie-builder formatting by writing payload chunk indices into the strings.Builder with a stack buffer plus strconv.AppendInt instead of strconv.Itoa string allocations. Secondary metrics stayed flat and the broader xhttp_ns_sum regressed slightly, so discard.","timestamp":1773631141572,"segment":0}
{"run":13,"commit":"5e9ffe7","metric":0,"metrics":{},"status":"crash","description":"Prototype a pooled small-body read path for FillPacketRequest so header/cookie payload placement can reuse request-body buffers instead of allocating a fresh slice per request. This run crashed at build time because the new pooled-body regression test was missing an io import; fix and retry.","timestamp":1773631532399,"segment":0}
{"run":14,"commit":"5e9ffe7","metric":290300.46,"metrics":{},"status":"discard","description":"Try reusing small packet-up request-body buffers from a sync.Pool in FillPacketRequest so header/cookie payload placement avoids allocating a fresh body slice for each request. The pool cut secondary bytes, but it regressed the broader xhttp_ns_sum badly under the mixed workload, so discard.","timestamp":1773631679102,"segment":0}
{"run":15,"commit":"5e9ffe7","metric":309551.18,"metrics":{},"status":"discard","description":"Try precomputing the payload key prefixes (`key-` / `key_`) once per request-shaping call so hot chunk loops only concatenate the numeric suffix. This badly regressed the broader xhttp_ns_sum workload despite unchanged secondary metrics, so discard.","timestamp":1773631872229,"segment":0}
{"run":16,"commit":"5e9ffe7","metric":183806.29,"metrics":{},"status":"discard","description":"Try caching a per-config base request-header template in a sync.Map and cloning it on each GetRequestHeader call, with a regression test to ensure callers still receive independent header copies. Despite the profile pointing at GetRequestHeader, the broader xhttp_ns_sum regressed, so discard.","timestamp":1773632182383,"segment":0}
{"run":17,"commit":"5e9ffe7","metric":355233.37,"metrics":{},"status":"discard","description":"Try bypassing net/http Header.Set in the payload-header chunk loops by canonicalizing the uplink-data key once with textproto.CanonicalMIMEHeaderKey and assigning single-value slices directly into the header map. Added a regression test for lowercase custom keys, but the broader xhttp_ns_sum workload regressed badly, so discard.","timestamp":1773632418644,"segment":0}
{"run":18,"commit":"5e9ffe7","metric":197797.59,"metrics":{},"status":"discard","description":"Try avoiding request.URL.String when xpadding does not actually need a RawURL by teaching FillStreamRequest/FillPacketRequest to pass an empty requestURL into GetRequestPaddingConfig unless the effective placement is query-in-header. Added focused coverage for the placement decision helper. Secondary bytes/allocs improved slightly, but the broader xhttp_ns_sum regressed, so discard.","timestamp":1773632721838,"segment":0}
{"run":19,"commit":"5e9ffe7","metric":331094.67,"metrics":{},"status":"discard","description":"Try streamlining appendCookieHeader for metadata/xpadding cookies by bypassing Header.Set, pre-growing a builder for the final Cookie string, and rebuilding the header value directly from the existing Cookie slice plus the new pair. It reduced secondary bytes/allocs slightly, but the broader xhttp_ns_sum regressed sharply, so discard.","timestamp":1773632889748,"segment":0}
{"run":20,"commit":"5e9ffe7","metric":343015.66,"metrics":{},"status":"discard","description":"Try trimming GetRequestHeader overhead by preallocating the header map and tracking whether User-Agent was already supplied with strings.EqualFold during the configured-header copy, so the function can skip the trailing Header.Get probe on every request. This regressed the broader xhttp_ns_sum workload badly, so discard.","timestamp":1773633201512,"segment":0}
{"run":21,"commit":"084211c","metric":161552.67,"metrics":{},"status":"keep","description":"Reduce repeated chunk-index formatting in request shaping by precomputing decimal strings for the first 64 payload chunk indices and reusing them across header/cookie payload emission plus cookie-header size estimation, falling back to strconv.Itoa only for larger chunk counts. This preserves header/cookie names exactly while shaving a bit more hot-loop string work from both payload placements; splithttp tests stay green.","timestamp":1773635121479,"segment":0}
{"run":22,"commit":"be193c6","metric":148989.08,"metrics":{},"status":"keep","description":"Speed up query-in-header xpadding by reusing setURLQueryParam inside ApplyXPaddingToHeader after URL parsing, instead of always round-tripping through u.Query plus q.Set plus q.Encode. This preserves existing replacement semantics through the helper fallback while letting the common safe append case skip a full query re-encode, cutting the mixed xhttp workload further; splithttp tests stay green.","timestamp":1773635362776,"segment":0}
{"run":23,"commit":"be193c6","metric":167410.65,"metrics":{},"status":"discard","description":"Try caching repeat-x padding strings for lengths up to 1024 so GeneratePadding can reuse immutable strings instead of calling strings.Repeat on every xpadding request/response. This cut secondary bytes and allocs, but the broader xhttp_ns_sum regressed, so discard.","timestamp":1773635716386,"segment":0}
